{
	"FormatVersion": 1,
	"Description": "Faceting demo: declared facets and a named scope over the Bookstore-Tenant fixture (Book <- Review), so the Bookstore explorer shows the cross-entity kinds next to the auto facets: a multi-valued Terms through a child table (K9), a child-count band (K12 ChildRollup), an exists split (K20) and an Exists scope. Validated against the M2 registry (0 disabled, 0 warnings).",
	"Scopes":
	{
		"Book.WellReviewed":
		{
			"Entity": "Book",
			"Description": "Books with at least one review rated 4 or 5",
			"Where":
			[
				{ "Exists": { "Path": [ "<Review.IDBook" ], "Where": [ { "Field": "Rating", "Op": "GE", "Value": 4 } ] } }
			]
		}
	},
	"Facets":
	[
		{
			"Facet": "Book.ReviewRating",
			"Version": 1,
			"Title": "Review rating",
			"Description": "Books by the ratings their reviews gave (a book counts once per distinct rating it received, so the buckets can sum to more than the total).",
			"Dimensions": [ { "Kind": "Terms", "Path": [ "<Review.IDBook" ], "KeyField": "Rating", "Top": 10 } ],
			"CountMode": "PivotDistinct",
			"Exclude": "Self"
		},
		{
			"Facet": "Book.ReviewCount",
			"Version": 1,
			"Title": "Reviews per book",
			"Dimensions": [ { "Kind": "ChildRollup", "Child": { "Path": [ "<Review.IDBook" ], "Agg": "count" }, "Edges": [ 1, 3, 5, 10 ] } ],
			"Exclude": "None"
		},
		{
			"Facet": "Book.HasFiveStar",
			"Version": 1,
			"Title": "Five-star reviews",
			"Dimensions":
			[
				{ "Kind": "ExistsSplit", "Path": [ "<Review.IDBook" ], "Where": [ { "Field": "Rating", "Op": "EQ", "Value": 5 } ],
				  "Labels": { "true": "Has a 5-star review", "false": "No 5-star review" } }
			],
			"Exclude": "None"
		}
	]
}
